<?xml version="1.0" encoding="utf-8"?>
<!--David Vrane 04/01/2016-->
<CytovilleFluidics xmlns:xsi="http://www.w3.org/2001/XMLSchema-instance" xsi:noNamespaceSchemaLocation="CytovilleFluidics.xsd">
  <Mode>
    <ModeName>BOOST_RUN_HIGH</ModeName>
    <Description>This mode boosts sample into the flow cell under full vacuum prior to starting sheath flow.</Description>
    <TimeSegment>
      <Description>Wait</Description>
      <Time>TUBE</Time>
      <Valve>
        <V1>Off</V1>
        <V2>Off</V2>
        <V3>Off</V3>
        <V4>Off</V4>
        <V5>Off</V5>
        <V6>Off</V6>
      </Valve>
      <Pump>
        <VACUUM>Diff</VACUUM>
        <P1>On</P1>
        <P2>Off</P2>
        <P3>Off</P3>
      </Pump>
      <Sample>
        <FlowRate>High</FlowRate>
      </Sample>
    </TimeSegment>
    <TimeSegment>
      <Description>Wait</Description>
      <Time>SITD</Time>
      <Valve>
        <V1>Off</V1>
        <V2>Off</V2>
        <V3>Off</V3>
        <V4>Off</V4>
        <V5>Off</V5>
        <V6>Off</V6>
      </Valve>
      <Pump>
        <VACUUM>Diff</VACUUM>
        <P1>On</P1>
        <P2>Off</P2>
        <P3>Off</P3>
      </Pump>
      <Sample>
        <FlowRate>High</FlowRate>
      </Sample>
    </TimeSegment>
    <TimeSegment>
      <Description>Boost sample</Description>
      <Time>KT07</Time>
      <Valve>
        <V1>Off</V1>
        <V2>Off</V2>
        <V3>On</V3>
        <V4>Off</V4>
        <V5>Off</V5>
        <V6>Off</V6>
      </Valve>
      <Pump>
        <VACUUM>Diff</VACUUM>
        <P1>On</P1>
        <P2>Off</P2>
        <P3>Off</P3>
      </Pump>
      <Sample>
        <FlowRate>High</FlowRate>
      </Sample>
    </TimeSegment>
    <TimeSegment>
      <Description>Boost sample</Description>
      <Time>KT07</Time>
      <Valve>
        <V1>Off</V1>
        <V2>Off</V2>
        <V3>On</V3>
        <V4>Off</V4>
        <V5>Off</V5>
        <V6>Off</V6>
      </Valve>
      <Pump>
        <VACUUM>Diff</VACUUM>
        <P1>On</P1>
        <P2>Off</P2>
        <P3>Off</P3>
      </Pump>
      <Sample>
        <FlowRate>High</FlowRate>
      </Sample>
    </TimeSegment>
    <TimeSegment>
      <Description>Boost sample</Description>
      <Time>KT01</Time>
      <Valve>
        <V1>Off</V1>
        <V2>Off</V2>
        <V3>On</V3>
        <V4>Off</V4>
        <V5>Off</V5>
        <V6>Off</V6>
      </Valve>
      <Pump>
        <VACUUM>Diff</VACUUM>
        <P1>On</P1>
        <P2>Off</P2>
        <P3>Off</P3>
      </Pump>
      <Sample>
        <FlowRate>High</FlowRate>
      </Sample>
    </TimeSegment>
    <TimeSegment>
      <Description>Vent accumulator chamber</Description>
      <Time>KT01</Time>
      <Valve>
        <V1>Off</V1>
        <V2>Off</V2>
        <V3>Off</V3>
        <V4>Off</V4>
        <V5>On</V5>
        <V6>Off</V6>
      </Valve>
      <Pump>
        <VACUUM>Diff</VACUUM>
        <P1>On</P1>
        <P2>Off</P2>
        <P3>Off</P3>
      </Pump>
      <Sample>
        <FlowRate>High</FlowRate>
      </Sample>
    </TimeSegment>
    <TimeSegment>
      <Description>Run at high flow rate</Description>
      <Time>TOGG</Time>
      <Valve>
        <V1>On</V1>
        <V2>Off</V2>
        <V3>On</V3>
        <V4>Off</V4>
        <V5>Off</V5>
        <V6>Off</V6>
      </Valve>
      <Pump>
        <VACUUM>Diff</VACUUM>
        <P1>On</P1>
        <P2>Off</P2>
        <P3>Off</P3>
      </Pump>
      <Sample>
        <FlowRate>High</FlowRate>
      </Sample>
    </TimeSegment>
  </Mode>
  <Mode>
    <ModeName>BOOST_RUN_MED</ModeName>
    <Description>This mode boosts sample into the flow cell under full vacuum prior to starting sheath flow.</Description>
    <TimeSegment>
      <Description>Wait</Description>
      <Time>TUBE</Time>
      <Valve>
        <V1>Off</V1>
        <V2>Off</V2>
        <V3>Off</V3>
        <V4>Off</V4>
        <V5>Off</V5>
        <V6>Off</V6>
      </Valve>
      <Pump>
        <VACUUM>Diff</VACUUM>
        <P1>Off</P1>
        <P2>Off</P2>
        <P3>Off</P3>
      </Pump>
      <Sample>
        <FlowRate>Med</FlowRate>
      </Sample>
    </TimeSegment>
    <TimeSegment>
      <Description>Wait</Description>
      <Time>SITD</Time>
      <Valve>
        <V1>Off</V1>
        <V2>Off</V2>
        <V3>Off</V3>
        <V4>Off</V4>
        <V5>Off</V5>
        <V6>Off</V6>
      </Valve>
      <Pump>
        <VACUUM>Diff</VACUUM>
        <P1>Off</P1>
        <P2>Off</P2>
        <P3>Off</P3>
      </Pump>
      <Sample>
        <FlowRate>Med</FlowRate>
      </Sample>
    </TimeSegment>
    <TimeSegment>
      <Description>Boost sample</Description>
      <Time>KT07</Time>
      <Valve>
        <V1>Off</V1>
        <V2>Off</V2>
        <V3>On</V3>
        <V4>Off</V4>
        <V5>Off</V5>
        <V6>Off</V6>
      </Valve>
      <Pump>
        <VACUUM>Diff</VACUUM>
        <P1>Off</P1>
        <P2>Off</P2>
        <P3>Off</P3>
      </Pump>
      <Sample>
        <FlowRate>Med</FlowRate>
      </Sample>
    </TimeSegment>
    <TimeSegment>
      <Description>Boost sample</Description>
      <Time>KT07</Time>
      <Valve>
        <V1>Off</V1>
        <V2>Off</V2>
        <V3>On</V3>
        <V4>Off</V4>
        <V5>Off</V5>
        <V6>Off</V6>
      </Valve>
      <Pump>
        <VACUUM>Diff</VACUUM>
        <P1>Off</P1>
        <P2>Off</P2>
        <P3>Off</P3>
      </Pump>
      <Sample>
        <FlowRate>Med</FlowRate>
      </Sample>
    </TimeSegment>
    <TimeSegment>
      <Description>Boost sample</Description>
      <Time>KT01</Time>
      <Valve>
        <V1>Off</V1>
        <V2>Off</V2>
        <V3>On</V3>
        <V4>Off</V4>
        <V5>Off</V5>
        <V6>Off</V6>
      </Valve>
      <Pump>
        <VACUUM>Diff</VACUUM>
        <P1>Off</P1>
        <P2>Off</P2>
        <P3>Off</P3>
      </Pump>
      <Sample>
        <FlowRate>Med</FlowRate>
      </Sample>
    </TimeSegment>
    <TimeSegment>
      <Description>Vent accumulator chamber</Description>
      <Time>KT02</Time>
      <Valve>
        <V1>Off</V1>
        <V2>Off</V2>
        <V3>Off</V3>
        <V4>Off</V4>
        <V5>On</V5>
        <V6>Off</V6>
      </Valve>
      <Pump>
        <VACUUM>Diff</VACUUM>
        <P1>Off</P1>
        <P2>Off</P2>
        <P3>Off</P3>
      </Pump>
      <Sample>
        <FlowRate>Med</FlowRate>
      </Sample>
    </TimeSegment>
    <TimeSegment>
      <Description>Run at high flow rate</Description>
      <Time>TOGG</Time>
      <Valve>
        <V1>On</V1>
        <V2>Off</V2>
        <V3>On</V3>
        <V4>Off</V4>
        <V5>Off</V5>
        <V6>Off</V6>
      </Valve>
      <Pump>
        <VACUUM>Diff</VACUUM>
        <P1>Off</P1>
        <P2>Off</P2>
        <P3>Off</P3>
      </Pump>
      <Sample>
        <FlowRate>Med</FlowRate>
      </Sample>
    </TimeSegment>
  </Mode>
  <Mode>
    <ModeName>BOOST_RUN_LOW</ModeName>
    <Description>This mode boosts sample into the flow cell under full vacuum prior to starting sheath flow.</Description>
    <TimeSegment>
      <Description>Wait</Description>
      <Time>TUBE</Time>
      <Valve>
        <V1>Off</V1>
        <V2>Off</V2>
        <V3>Off</V3>
        <V4>Off</V4>
        <V5>Off</V5>
        <V6>Off</V6>
      </Valve>
      <Pump>
        <VACUUM>Diff</VACUUM>
        <P1>Off</P1>
        <P2>Off</P2>
        <P3>Off</P3>
      </Pump>
      <Sample>
        <FlowRate>Low</FlowRate>
      </Sample>
    </TimeSegment>
    <TimeSegment>
      <Description>Wait</Description>
      <Time>SITD</Time>
      <Valve>
        <V1>Off</V1>
        <V2>Off</V2>
        <V3>Off</V3>
        <V4>Off</V4>
        <V5>Off</V5>
        <V6>Off</V6>
      </Valve>
      <Pump>
        <VACUUM>Diff</VACUUM>
        <P1>Off</P1>
        <P2>Off</P2>
        <P3>Off</P3>
      </Pump>
      <Sample>
        <FlowRate>Low</FlowRate>
      </Sample>
    </TimeSegment>
    <TimeSegment>
      <Description>Boost sample</Description>
      <Time>KT07</Time>
      <Valve>
        <V1>Off</V1>
        <V2>Off</V2>
        <V3>On</V3>
        <V4>Off</V4>
        <V5>Off</V5>
        <V6>Off</V6>
      </Valve>
      <Pump>
        <VACUUM>Diff</VACUUM>
        <P1>Off</P1>
        <P2>Off</P2>
        <P3>Off</P3>
      </Pump>
      <Sample>
        <FlowRate>Low</FlowRate>
      </Sample>
    </TimeSegment>
    <TimeSegment>
      <Description>Boost sample</Description>
      <Time>KT07</Time>
      <Valve>
        <V1>Off</V1>
        <V2>Off</V2>
        <V3>On</V3>
        <V4>Off</V4>
        <V5>Off</V5>
        <V6>Off</V6>
      </Valve>
      <Pump>
        <VACUUM>Diff</VACUUM>
        <P1>Off</P1>
        <P2>Off</P2>
        <P3>Off</P3>
      </Pump>
      <Sample>
        <FlowRate>Low</FlowRate>
      </Sample>
    </TimeSegment>
    <TimeSegment>
      <Description>Boost sample</Description>
      <Time>KT01</Time>
      <Valve>
        <V1>Off</V1>
        <V2>Off</V2>
        <V3>On</V3>
        <V4>Off</V4>
        <V5>Off</V5>
        <V6>Off</V6>
      </Valve>
      <Pump>
        <VACUUM>Diff</VACUUM>
        <P1>Off</P1>
        <P2>Off</P2>
        <P3>Off</P3>
      </Pump>
      <Sample>
        <FlowRate>Low</FlowRate>
      </Sample>
    </TimeSegment>
    <TimeSegment>
      <Description>Vent accumulator chamber</Description>
      <Time>KT03</Time>
      <Valve>
        <V1>Off</V1>
        <V2>Off</V2>
        <V3>Off</V3>
        <V4>Off</V4>
        <V5>On</V5>
        <V6>Off</V6>
      </Valve>
      <Pump>
        <VACUUM>Diff</VACUUM>
        <P1>Off</P1>
        <P2>Off</P2>
        <P3>Off</P3>
      </Pump>
      <Sample>
        <FlowRate>Low</FlowRate>
      </Sample>
    </TimeSegment>
    <TimeSegment>
      <Description>Run at high flow rate</Description>
      <Time>TOGG</Time>
      <Valve>
        <V1>On</V1>
        <V2>Off</V2>
        <V3>On</V3>
        <V4>Off</V4>
        <V5>Off</V5>
        <V6>Off</V6>
      </Valve>
      <Pump>
        <VACUUM>Diff</VACUUM>
        <P1>Off</P1>
        <P2>Off</P2>
        <P3>Off</P3>